{
  "name": "dendrite",
  "owner": {
    "name": "Jacob Magar",
    "email": "jmagar@users.noreply.github.com"
  },
  "description": "Claude Code and Codex plugin marketplace for agent skills, MCP integrations, hooks, commands, and companion agents.",
  "interface": {
    "displayName": "Dendrite",
    "shortDescription": "Cross-agent plugin marketplace for Claude Code and Codex.",
    "longDescription": "Dendrite collects portable agent capabilities: skills, MCP integrations, hooks, commands, companion agents, and marketplace metadata for Claude Code and Codex."
  },
  "plugins": [
    {
      "name": "acp",
      "description": "Agent Client Protocol skills for Rust, Python, and TypeScript implementations.",
      "source": {
        "source": "local",
        "path": "./plugins/acp"
      },
      "policy": {
        "installation": "AVAILABLE",
        "authentication": "ON_USE"
      },
      "category": "Developer Tools",
      "interface": {
        "displayName": "ACP",
        "shortDescription": "Agent Client Protocol implementation guidance for Rust, Python, and TypeScript.",
        "longDescription": "ACP packages implementation skills and protocol references for building Agent Client Protocol clients and agents, including session lifecycle, streaming, tool calls, and adapter patterns.",
        "developerName": "Jacob Magar",
        "category": "Developer Tools",
        "capabilities": [
          "Read"
        ],
        "defaultPrompt": [
          "Use ACP to design a Rust agent-client-protocol integration.",
          "Review this ACP session lifecycle implementation.",
          "Explain how ACP tool calls should stream results."
        ],
        "brandColor": "#7C3AED"
      }
    },
    {
      "name": "adguard",
      "description": "Skill for operating adguard via the lab MCP server / CLI.",
      "source": {
        "source": "local",
        "path": "./plugins/adguard"
      },
      "policy": {
        "installation": "AVAILABLE",
        "authentication": "ON_USE"
      },
      "category": "Network",
      "interface": {
        "displayName": "AdGuard Home",
        "shortDescription": "Operate AdGuard Home DNS filtering and network-blocking workflows.",
        "longDescription": "AdGuard Home provides agent workflows for inspecting DNS filtering state, reviewing blocked queries, managing allow/block decisions, and troubleshooting homelab DNS behavior.",
        "developerName": "Jacob Magar",
        "category": "Network",
        "capabilities": [
          "Read",
          "Write"
        ],
        "defaultPrompt": [
          "Use AdGuard to inspect DNS filtering health.",
          "Find recent blocked domains for a client.",
          "Help troubleshoot why a domain is not resolving."
        ],
        "brandColor": "#22C55E"
      }
    },
    {
      "name": "agent-browser",
      "description": "Browser automation CLI for AI agents \u2014 navigate pages, fill forms, click, screenshot, scrape, and test web apps from your coding agent.",
      "source": {
        "source": "url",
        "url": "https://github.com/vercel-labs/agent-browser.git",
        "sha": "2c7991c9eccca1c9db6eee1a26a713414778de5a"
      },
      "policy": {
        "installation": "AVAILABLE",
        "authentication": "ON_USE"
      },
      "category": "Productivity",
      "interface": {
        "displayName": "Agent Browser",
        "shortDescription": "Drive a real browser from your agent \u2014 navigate, fill, click, screenshot, scrape, and test.",
        "longDescription": "Agent Browser is a browser automation CLI built for AI agents. It navigates pages, fills forms, clicks elements, captures screenshots, extracts data, and exercises web apps for exploratory testing and QA. Also automates Electron desktop apps and supports Vercel Sandbox microVMs and AWS Bedrock AgentCore cloud browsers.",
        "developerName": "Vercel Labs",
        "category": "Productivity",
        "capabilities": [
          "Read",
          "Write",
          "Automation"
        ],
        "defaultPrompt": [
          "Use Agent Browser to fill out and submit this web form.",
          "Use Agent Browser to screenshot and verify this page.",
          "Use Agent Browser to click through and test this web app."
        ],
        "brandColor": "#000000"
      }
    },
    {
      "name": "agent-os",
      "description": "Drive the agent-os Windows 11 sandbox VM through the Labby gateway or an already-configured Windows-MCP endpoint.",
      "source": {
        "source": "local",
        "path": "./plugins/agent-os"
      },
      "policy": {
        "installation": "AVAILABLE",
        "authentication": "ON_INSTALL"
      },
      "category": "Developer Tools",
      "interface": {
        "displayName": "Agent OS",
        "shortDescription": "Drive the dedicated Windows 11 agent VM through Windows-MCP.",
        "longDescription": "Agent OS connects Codex to the dedicated Windows 11 sandbox VM for desktop automation, Windows app testing, screenshots, shell commands, and VM health checks.",
        "developerName": "Jacob Magar",
        "category": "Developer Tools",
        "capabilities": [
          "Interactive",
          "Read",
          "Write"
        ],
        "defaultPrompt": [
          "Use Agent OS to inspect the Windows VM.",
          "Run a PowerShell command on agent-os.",
          "Take a screenshot of the agent-os desktop."
        ],
        "brandColor": "#60A5FA"
      }
    },
    {
      "name": "beads",
      "description": "AI-supervised issue tracker for coding workflows.",
      "source": {
        "source": "git-subdir",
        "url": "https://github.com/gastownhall/beads.git",
        "path": "plugins/beads"
      },
      "policy": {
        "installation": "AVAILABLE",
        "authentication": "ON_USE"
      },
      "category": "Developer Tools",
      "interface": {
        "displayName": "Beads",
        "shortDescription": "AI-supervised issue tracker with beads for task creation, progress tracking, and dependency management.",
        "longDescription": "Beads is a lightweight issue tracker purpose-built for AI coding workflows. Create issues before writing code, claim work, track dependencies, close on completion, and search persistent knowledge \u2014 all via the bd CLI. Replaces TodoWrite and markdown task files with a durable, cross-session store.",
        "developerName": "gastownhall",
        "category": "Developer Tools",
        "capabilities": [
          "Read",
          "Write",
          "Automation"
        ],
        "defaultPrompt": [
          "Use Beads to list ready work.",
          "Create a Beads issue for this task.",
          "Show blocked Beads issues and their dependencies."
        ],
        "brandColor": "#6366F1"
      }
    },
    {
      "name": "bytestash",
      "description": "Skills for operating a ByteStash snippet manager.",
      "source": {
        "source": "local",
        "path": "./plugins/bytestash"
      },
      "policy": {
        "installation": "AVAILABLE",
        "authentication": "ON_USE"
      },
      "category": "Productivity",
      "interface": {
        "displayName": "ByteStash",
        "shortDescription": "Manage ByteStash snippets and reusable code notes.",
        "longDescription": "ByteStash provides snippet search, creation, update, organization, and troubleshooting workflows for the self-hosted code snippet manager.",
        "developerName": "Jacob Magar",
        "category": "Productivity",
        "capabilities": [
          "Read",
          "Write"
        ],
        "defaultPrompt": [
          "Use ByteStash to search for a Docker snippet.",
          "Create a ByteStash snippet from this script.",
          "Organize snippets related to Rust."
        ],
        "brandColor": "#14B8A6"
      }
    },
    {
      "name": "dozzle",
      "description": "Real-time Docker container log viewer via direct Dozzle API checks and Labby gateway guidance.",
      "source": {
        "source": "local",
        "path": "./plugins/dozzle"
      },
      "policy": {
        "installation": "AVAILABLE",
        "authentication": "ON_INSTALL"
      },
      "category": "Operations",
      "interface": {
        "displayName": "Dozzle",
        "shortDescription": "Inspect Docker container logs through Dozzle and its native MCP endpoint.",
        "longDescription": "Dozzle provides direct HTTP and MCP-oriented workflows for checking live Docker container logs, authentication setup, and log-viewer connectivity.",
        "developerName": "Jacob Magar",
        "category": "Operations",
        "capabilities": [
          "Read"
        ],
        "defaultPrompt": [
          "Use Dozzle to inspect recent container logs.",
          "Check whether Dozzle MCP is reachable.",
          "Help debug a container error from Dozzle logs."
        ],
        "brandColor": "#F97316"
      }
    },
    {
      "name": "immich",
      "description": "Self-hosted photo and video management via direct calls to the Immich REST API.",
      "source": {
        "source": "local",
        "path": "./plugins/immich"
      },
      "policy": {
        "installation": "AVAILABLE",
        "authentication": "ON_USE"
      },
      "category": "Media",
      "interface": {
        "displayName": "Immich",
        "shortDescription": "Operate Immich photo and video management workflows.",
        "longDescription": "Immich packages workflows for searching assets, reviewing albums and jobs, checking server state, and assisting with self-hosted photo library operations.",
        "developerName": "Jacob Magar",
        "category": "Media",
        "capabilities": [
          "Read",
          "Write"
        ],
        "defaultPrompt": [
          "Use Immich to inspect recent upload status.",
          "Search Immich for assets from a date range.",
          "Check Immich server health."
        ],